"","x"
"764","Oramed Pharmaceuticals, or Oramed (Hebrew: <U+05D0><U+05D5><U+05E8><U+05DE><U+05D3><U+200E>), is a publicly traded company engaged in the development of oral drug delivery systems – most notably an oral insulin capsule for treating type 2 diabetes. The company was founded in 2006 and is headquartered in Jerusalem, Israel. Its shares are listed on the NASDAQ Capital Market."
"765","Essendant, formerly known as United Stationers, is a national wholesale distributor of office supplies, with consolidated net sales of $5.3 billion. Essendant stocks over 160,000 items including traditional office products, office furniture, janitorial and break room supplies, technology products, industrial supplies and automotive aftermarket tools and equipment. Essendant is headquartered in Deerfield, Illinois and also has operations in Dubai, United Arab Emirates (UAE). The company operates as an online retailer and sells industrial tools direct to consumers."
"766","Vericel Corporation is a public, American biopharmaceutical company which was known prior to October 2014 as Aastrom Bio.  Aastrom Bio was formed in 1989 in Ann Arbor, Michigan.In the spring of 2014, Aastrom Bio acquired Sanofi's cell therapy and regenerative medicine business which Sanofi had acquired when purchasing Genzyme in 2011.  This transformed Aastrom in several ways: it increased the employee count by 8-fold and provided a revenue stream and products to market, which it had not had before.In October 2014, the company changed its name from Aastrom Bio to Vericel and relocated its headquarters from Ann Arbor, Michigan to Cambridge, Massachusetts.


== References =="
"767","GSE Systems, Inc. develops and markets software-based simulation and training products to nuclear, oil, and gas electricity generators, and the chemical process industries. It also sells software for monitoring and optimizing plant and signal analysis to the power industry.
GSE Systems was established in 1994 from three simulation companies that came together.  They were part of an original heritage from  Singer-Link where they were involved in high-intensity simulation applications such as flight simulators.  Since 1994 the company has grown through acquisitions.  The primary businesses continue to be process control focused in the chemical, pharmaceutical and food industry, and simulation, which is also focused on fossil and nuclear simulation.
GSE Systems is headquartered in suburban Baltimore, Maryland. Global operations are conducted from offices in Sykesville (Maryland), Nyköping (Sweden), Beijing (China), Stockton-on-Tees (UK), and Chennai (India).
Timeline:
1929 Edwin Albert Link invents and patents the first Link Trainer, forms Link Aeronautical Corporation in Binghamton, NY.
1930 Link Flying School organized in Binghamton.
1933 Link Aeronautical Corporation moves to Endicott, NY to maintain the flight school, repair airplanes, and operate charter flights.
1934 Link Aeronautical Corporation returns to Binghamton.
1935 Link Aviation Devices, Inc. is formed in Binghamton, NY to manufacture trainers etc. Link Aviation Devices, Inc. renamed Link Aviation, Inc.
1937 Link Manufacturing Company Limited is formed in Gananoque, Ontario to build
trainers for Canadian and UK customers.
1953 Ed Link steps down as president of Link Aviation.
1954 Ed and George Link sell Link Aviation to General Precision Equipment Corporation.
1956 Link Aviation acquires a controlling interest in Air Trainers Limited of England and changes its name to Air Trainers Link Limited.
1959 Ownership of Air Trainers Link Limited is transferred to the parent company, GPE, and the name changes to General Precision Systems Ltd.
1965 GPE buys the operations of the Riverdale, MD plant of Electronics Division of ACF Industries (previously ERCO) and moves it to Silver Spring, MD.
1967 Redifon, a member of Rediffusion, buys Air Trainers Link Ltd. and renames it Redifon Air Trainers Ltd.
1968 Singer Corporation acquires GPE. Edwin Link remains as consultant until 1972.
1984 Simuflite Training International Inc. is founded by Singer.
1987 Singer’s Link Division is incorporated as Link Corporation.
1988 Paul A. Bilzerian buys Singer Corporation.
1988 CAE Industries, Ltd. buys Link Corporation of Silver Spring, MD.
1988 Singer’s simulation manufacturing business is reorganized under the name of LinkMiles with two companies: Link-Miles Limited located in Lancing, England and LinkMiles International Simulation Corporation based in Binghamton, NY.
1989 Singer is renamed Bicoastal Corporation.
1989 Bicoastal Corporation files Chapter 11 bankruptcy.
1990 Link-Miles Simulation Corporation of Columbia, MD is renamed S3 Technologies.
1990 Thomson-CSF of France buys Link-Miles Limited, merges it with Redifussion Simulation, and renames it Thomson Training & Simulation.
1992 Bicoastal Corporation is dissolved.
1993 ManTech International buys S3 Technologies.
1995 Hughes Electronics Corporation buys CAE-Link.
1994 GSE Systems (Global Simulation & Engineering Systems) absorbs S3 Technologies.
Major Milestones:
In 2011, Construction of Westinghouse AP1000 nuclear power plant simulator, a first-of-a-kind project
In 1977, GSE was a pioneer provider of high-fidelity refinery and fossil power plant simulators. Since then, GSE has built more full-scope simulators than all of its competitors combined.
In 1971, GSE Systems, then Link Simulation, built the first commercial full-scope nuclear power plant simulator.
Major Acquisitions:
GSE Systems Acquires EnVision Systems, Inc in the year 2011.  EnVision Systems, Inc. (“EnVision”), which provides interactive multi-media tutorials and simulation models, primarily to the petrochemical and oil & gas refining industries.  EnVision, with headquarters in Madison, NJ and an office in Chennai, India, was founded in 1991. EnVision’s tutorials and simulation models serve the rapidly growing entry-level training market for the oil & gas refining and specialty chemicals industries. EnVision’s products provide a foundation in process fundamentals and plant operations and interaction. With this knowledge base, users may then graduate to the full-scope, high-fidelity, real-time simulators provided by GSE. EnVision has completed more than 750 installations in over 28 countries and its approximately 130 clients include Shell Oil Company, BP, Total and Chevron."
"768","BOK Financial Corporation is a bank holding company headquartered in the BOK Tower in Tulsa, Oklahoma. The company is 60% owned by George Kaiser, who acquired the bank in 1991 from the FDIC. It is the largest bank in Oklahoma, with 14% of the total deposits in the state. As of December 17, 2017, 17% of its loan portfolio was to borrowers in the petroleum industry.
BOK is an acronym for ""Bank of Oklahoma"".
The company operates 7 banks with branches in 8 states: Bank of Oklahoma, Bank of Texas, Bank of Albuquerque, Bank of Arizona, Bank of Arkansas, Colorado State Bank and Trust, and MoBank. It also operates TransFund, Cavanal Hill Investment Management, BOSC, Inc. and the Milestone Group."
"769","Diamondback Energy is a company engaged in hydrocarbon exploration. It is organized in Delaware and headquartered in Midland, Texas.
As of December 31, 2018, the company had 992 million barrels of oil equivalent (6.07×109 GJ) of estimated proved reserves, of which 63% was petroleum, 19% was natural gas, and 18% was natural gas liquids. The company's reserves are all in the Permian Basin."
"770","Qorvo is an American semiconductor company that designs, manufactures, and supplies radio-frequency systems and solutions for applications that drive wireless and broadband communications, as well as foundry services. The company, which trades on NASDAQ, was created by the merger of TriQuint Semiconductor and RF Micro Devices, which was announced in 2014 and completed on January 1, 2015. The headquarters for the company originally were in both Hillsboro, Oregon (home of TriQuint), and Greensboro, North Carolina (home of RFMD), but in mid-2016 the company began referring to its North Carolina site as its exclusive headquarters."
"771","PayPal Holdings, Inc. is an American company operating a worldwide online payments system that supports online money transfers and serves as an electronic alternative to traditional paper methods like checks and money orders. The company operates as a payment processor for online vendors, auction sites, and many other commercial users, for which it charges a fee in exchange for benefits such as one-click transactions and password memory. PayPal's payment system, also called PayPal, is considered a type of payment rail.
Established in 1998 as Confinity, PayPal had its initial public offering in 2002, and became a wholly owned subsidiary of eBay later that year.  eBay spun off PayPal in 2015.
The company ranked 222nd on the 2018 Fortune 500 of the largest United States corporations by revenue."
"772","Napco Security Technologies, Inc. was set up in 1969 and now is based in Amityville, New York. The company focuses on security products, such as electronic locking devices, alarm systems, and building access control systems. The company was formerly known as Napco Security Systems, Inc."
"773","Gilead Sciences, Inc., commonly known as Gilead Sciences or Gilead (also styled GILEAD) , is an American biotechnology company that researches, develops and commercializes drugs. The company focuses primarily on antiviral drugs used in the treatment of HIV, hepatitis B, hepatitis C, and influenza, including Harvoni and Sovaldi.
Headquartered and founded in Foster City, California, Gilead is a member of the NASDAQ Biotechnology Index and the S&P 500."
"774","ScanSource, Inc. is a publicly held American technology company headquartered in Greenville, South Carolina, that provides point-of-sale, barcode, physical security, video, voice, data, networking, unified communications and collaboration, and cloud and telecom services. According to the company, ScanSource serves more than 500 suppliers and sells to approximately 33,000 reseller customers in North America, Latin America and Europe.
In August 2016, ScanSource entered the recurring revenue telecom and cloud services market by acquiring Intelisys, a technology services distributor. This acquisition brought the company’s number of employees worldwide to more than 2,500.Founded in 1992, ScanSource has been named one of the Best Places to Work in South Carolina the past four years, and was named to FORTUNE magazine's 2018 List of World's Most Admired Companies. ScanSource ranks #653 on the Fortune 1000. ScanSource's teams provide value-added solutions and operate from two segments: Worldwide Barcode, Networking & Security, which includes POS Portal, and Worldwide Communications & Services, which includes Intelisys and Canpango.


== References =="
"775","Mitcham Industries, Inc. (NASDAQ:MIND) was set up in 1987, and now is based in Huntsville, Texas. The company markets geophysical and other equipment to seismic data acquisition contractors conducting surveys on land, marsh, and marine areas, both shallow and deep water. There are mainly two segments operating in the company, namely an Equipment Leasing segment (for the oil and gas industry) and an Equipment Manufacturing segment. In October 2011, the Company opened a new logistics and repair facility in Budapest, Hungary, and three months later, it opened two new subsidiaries, namely Mitcham Europe Ltd. and Mitcham Marine Leasing Pte Ltd. On September 21, 2015, Founder and CEO Billy F. Mitcham Jr. died, and Guy M. Malden and Robert P. Capps were installed as Co-Chief Executive Officers."
"776","Tetra Tech, Inc. is a Pasadena, California-based consulting and engineering services firm. The company provides consulting, engineering, program management, and construction management services in the areas of water, environment, infrastructure, resource management, energy, and international development. Specific services for consulting and engineering projects include applied science, information technology, engineering, design, construction management, and operations and maintenance.Engineering News-Record ranked Tetra Tech number one in water for 15 years, and as the number four design firm on its 2018 “Top 500 Design Firms” list."
"777","Charm Communications Inc. (NASDAQ: CHRM) is the largest domestic television advertising company in China. It was incorporated in 2008 and is headquartered in Beijing. The company provides advertising agency services from planning and managing advertising campaigns. The company was listed as a public traded company in NASDAQ in 2010."
"778","Finisar Corporation is a manufacturer of optical communication components and subsystems. In 2008, Finisar merged with Optium Corporation.
Finisar's products include optical transceivers, optical engines, active optical cables, optical components, optical instrumentation, ROADM & wavelength management, optical amplifiers, and RF-over-Fiber. Their products enable high-speed voice, video and data communications for networking, storage, wireless, and cable TV applications.
In November 2018, II-VI Incorporated acquire Finisar."
"779","Methanex Corporation is a Canadian company that supplies, distributes and markets methanol worldwide.Methanex is the world’s largest producer and supplier of methanol to major international markets in North America, Asia Pacific, Europe and South America.  Methanex is headquartered in Vancouver, British Columbia, Canada, and operates production sites in Canada, Chile, Egypt, New Zealand, the United States and Trinidad and Tobago.  Its global operations are supported by an extensive global supply chain of terminals, storage facilities and the world’s largest dedicated fleet of methanol ocean tankers.Methanex Corporation challenged California's plan to eliminate methyl tertiary butyl ether (MTBE) from gasoline on grounds of water pollution prevention, claiming protection under Chapter 11 of NAFTA and demanding $970 million in compensation from the state.In January 2012, Methanex announced it would move one of its idle Chilean plants to the United States.  Methanex later confirmed that they acquired land in Geismar, LA and Geismar would be the site in the United States where the idle Chilean plant would be moved to.  Methanex CEO, Bruce Aitken, confirmed in a press release on January 17, 2012 that the reason Methanex was shifting a methanol production plant from Chile to North America, specifically Louisiana, is due to the low price of natural gas available in North America and Louisiana.Regional marketing offices are located in Belgium, Chile, China, Egypt, Korea, Japan, the United Arab Emirates, the United Kingdom and the United States."
"780","Baidu, Inc. (Chinese: <U+767E><U+5EA6>; pinyin: Baidù, anglicized  BY-doo) is a Chinese multinational technology company specializing in Internet-related services and products and artificial intelligence (AI), headquartered in Beijing's Haidian District. It is one of the largest AI and internet companies in the world. The holding company of the group is incorporated in the Cayman Islands. Baidu was incorporated in January 2000 by Robin Li and Eric Xu. Baidu is currently ranked 4th overall in the Alexa Internet rankings.Baidu's Global Business Unit, formed under the name of DU Group or DU Apps Studio, is an app developer with various apps and services. It has over 2 billion active users worldwide. Baidu also provides an official international and Chinese version of its online digital distribution services Baidu App Store and Shouji Baidu respectively, both hosting downloadable content and applications. Baidu's advertisement platform is DU Ad Platform.
Baidu's Apollo Project is one of the world's leading autonomous driving and AI programs, with one of the largest partner ecosystems and over 100 global partners as of 2018, including BYD, Dongfeng, Microsoft, Intel, Nvidia, Daimler AG, ZTE, Grab, Ford, Hyundai and Honda.Baidu has the second largest search engine in the world, and held a 76.05% market share in China's search engine market. In December 2007, Baidu became the first Chinese company to be included in the NASDAQ-100 index. As of May 2018, Baidu's market cap rose to US$99 billion. In October 2018, Baidu became the first Chinese firm to join the United States-based computer ethics consortium Partnership on AI."
"781","Fogo de Chão (Brazilian Portuguese: ['fo.gu d<U+0292>i <U+0283><U+0250>~w]) is a fine dining, full-service Brazilian steakhouse or churrascaria, serving  rodízio style, featuring roving waiters serving barbecued meats from large skewers directly onto the seated diners' plates."
"782","CommunityOne Bank was a bank headquartered in Charlotte, North Carolina. In 2016, it was acquired by Capital Bank Financial."
"783","Elbit Imaging Ltd., formerly Elbit Medical Imaging Ltd., is an Israeli holding company with activities in real estate, medical imaging, hotels, shopping malls, and retail.
The company was founded as a spin-off from Elron Electronic Industries and Elbit, to develop and manufacture diagnostic systems and medical imaging devices; in 1999 Elbit Medical Imaging was sold to Europe-Israel Ltd., a company controlled by businessman Mordechai (Moti) Zisser, who turned it into a diversified holding company."
"784","Black Stone Minerals, L.P., or Black Stone Minerals, is a Houston, Texas-based oil and natural gas corporation."
"785","Activision Blizzard, Inc. is an American video game and film holding company based in Santa Monica, California. The company was founded in July 2008 through the merger of Activision and Vivendi Games, the company is traded on the NASDAQ stock exchange under the ticker symbol ATVI, and since 2015 has been one of the stocks that make up the S&P 500. Activision Blizzard currently includes five business units: Activision Publishing, Blizzard Entertainment, King, Major League Gaming, and Activision Blizzard Studios.The company owns and operates additional studios under an independent studios model under Activision Publishing, including Treyarch, Infinity Ward, High Moon Studios and Toys for Bob. Among major intellectual properties produced by Activision-Blizzard includes Call of Duty, Guitar Hero, Tony Hawk's, and Spyro/Skylanders through Activision's studios,  World of Warcraft, StarCraft, Diablo, Hearthstone, and Overwatch through Blizzard Entertainment, and mobile titles including Candy Crush Saga through King. Activision-Blizzard's titles have broken a number of release records. As of March 2018, it is the largest game company in the Americas and Europe in terms of revenue and market capitalization."
"786","Cintas Corporation () is an American company with headquarters in  Cincinnati, Ohio, that provides specialized services to businesses, primarily in North America. The firm designs, manufactures and implements corporate identity uniform programs and provides entrance mats, restroom cleaning and supplies, tile and carpet cleaning, promotional products, first aid, safety, and fire protection products and services. Cintas is a publicly held company traded on the Nasdaq Global Select Market under the symbol CTAS and is a component of the Standard & Poor's 500 Index.
The company is one of the largest in the industry with 35,000 employees in 2017. Revenue in fiscal year 2016 was $4.905 billion and net income was $693.52 million.  Fortune in the United States, named Cintas among its ""Most Admired Companies"" for eight consecutive years, and Report on Business Magazine named the company one of Canada's Best Employers.Cintas has been featured on episodes of the reality television series Bar Rescue and Hotel Impossible."
"787","Meta Financial Group, Inc., is the holding company for MetaBank, a federally chartered savings bank, Member Federal Deposit Insurance Corporation. Headquartered in Sioux Falls, S.D., MetaBank operates in several segments within the Banking and Payments industries: MetaBank, its traditional retail banking operation; Meta Payment Systems, its electronic payments division; AFS/IBEX, its insurance premium financing division; and Refund Advantage, EPS Financial and Specialty Consumer Services, its tax-related financial solutions divisions.
MetaBank, the retail banking division, operates 10 retail branches in four market areas: Central Iowa; Storm Lake, Iowa; Brookings, S.D..; and Sioux Falls, S.D.. MetaBank offers traditional banking services designed to serve the needs of individual, agricultural and business depositors and borrowers.
Meta Payment Systems (MPS) focuses on offering specific products in the following areas: prepaid cards, credit products, electronic funds transfer, Automated Teller Machine sponsorship and tax-related financial solutions.AFS/IBEX provides short-term, collateralized financing to facilitate the purchase of insurance for commercial property, casualty and liability risk. Based in Dallas, Texas, AFS/IBEX originates loans through a network of independent insurance agencies.
Refund Advantage, based in Louisville, Ky., provides tax refund-transfer software for Electronic Return Originators (EROs) and their customers. Their software is used in over 10,000 locations nationwide and processes over one million refund-transfers a year.EPS Financial (EPS) provides refund settlement products, prepaid payroll card solutions and merchant services. EPS is headquartered in Easton, Pa..
Specialty Consumer Services (SCS) provides consumer tax advance services through its proprietary underwriting model and loan management system. Based in Hurst, Texas, SCS was a pioneer for no-fee refund advance products."
"788","Rediff.com is an Indian news, information, entertainment and shopping web portal, founded in 1996 as ""Rediff On The NeT"". It is headquartered in Mumbai, with offices in Bangalore, New Delhi and New York City.According to Alexa, Rediff.com is the No. 32 Indian web portal as of 2019 and has more than 300 employees. Most of the visitors to Rediff.com are from India, while the rest come primarily from the United States and China."
"789","American Airlines Group Inc. is an American publicly traded airline holding company headquartered in Fort Worth, Texas. It was formed December 9, 2013, in the merger of AMR Corporation, the parent company of American Airlines, and US Airways Group, the parent company of US Airways. The airline groups together form the largest airline in the world, with more than 6,700 daily flights to 350 locations in 56 countries worldwide, about $40 billion in operating revenue, over 100,000 employees, and plans to take delivery of 607 new aircraft, including 517 narrowbody aircraft and 90 widebody international aircraft. The integration of American Airlines and US Airways was completed when the Federal Aviation Administration granted a single operating certificate for both carriers on April 8, 2015. The company ranked No. 71 in the 2018 Fortune 500 list of the largest United States corporations by total revenue."
"790","Penn National Gaming, Inc. is an Wyomissing, Pennsylvania based operator of casinos and racetracks.  It operates 42 facilities in the United States and Canada, many of them under the Hollywood Casino brand."
"791","Covenant Transport, Inc. is a truckload carrier headquartered in Chattanooga, Tennessee and is the expedited specialist of publicly traded parent company Covenant Transportation Group (CTG) (NASDAQ: CVTI) and doing business as Covenant Transport Services. The company provides temperature controlled trucking, regional delivery, and longhaul team driver delivery.It began operations on January 2, 1986, by founders David and Jacqueline Parker, with 25 trucks and 50 trailers.  The company now jointly operates over 3,000 trucks and 7,000 trailers with sister companies Southern Refrigerated Transport, Inc. (Texarkana, Arkansas), Star Transportation Inc. (La Vergne, TN) and Landair Transportation, Inc. (Greeneville, TN).  The four companies have shared terminals in Chattanooga, TN, Hutchins, TX, Pomona, CA, Texarkana, AR, La Vergne, TN, Allentown, PA, Orlando, FL, and Greenville, TN. 
In addition to the four asset-based companies, CTG owns a freight brokerage company, Covenant Transport Solutions, and an accounts receivable factoring company for smaller trucking companies, Transport Financial Solutions, both based in Chattanooga, TN.  CTG has a 49% stake in Transport Enterprise Leasing, a tractor and trailer leasing company that caters to smaller fleets and captive owner operator programs, in addition to used tractor and trailer sales.


== References =="
"792","SunOpta, Inc. is a multi-national food and mineral company headquartered in Canada and founded in 1973."
"793","PCSB Bank is a bank based in Yorktown Heights, New York. It is a wholly owned subsidiary of PCSB Financial Corporation, a bank holding company.
It has 15 branches."
"794","Amedisys Home Health and Hospice Care (NASDAQ: AMED), based in Baton Rouge, Louisiana, is one of the largest home health providers and fourth largest hospice care provider in the United States.
Amedisys provides in-home skilled nursing, Physical therapy, Occupational therapy and speech language pathology, medical social work, home aides, and hospice and bereavement services, with 11 million patient care visits in 2011.Amedisys employs more than 16,000 individuals at more than 500 locations in 45 states, Washington, D.C. and Puerto Rico. In 2010, annual revenues were approximately $1.6 billion.  Amedisys was ranked 999 on the Fortune 1000 in 2011."
