"","x"
"272","Gogo Inc. is a provider of in-flight broadband Internet service and other connectivity services for commercial and business aircraft, headquartered in Chicago, Illinois. 16 airlines partner with Gogo to provide in-flight WiFi, including British Airways, Aer Lingus, Iberia, Gol linhas aereas, Aeromexico, American Airlines, Air Canada, Alaska Airlines, Delta Air Lines, Japan Airlines, JTA, United Airlines, Hainan Airlines, Vietnam Airlines and Virgin Atlantic. Gogo Inc. is a holding company, operating through its two subsidiaries, Gogo LLC and Aircell Business Aviation Services LLC (now Gogo Business Aviation Inc.). According to Gogo, over 2,500 commercial aircraft and 6,600 business aircraft have been equipped with its onboard Wi-Fi services. The company is also the developer of 2Ku, the new in-flight (satellite solution) Wi-Fi technology."
"273",""
"274","First Financial Bancorp (NASDAQ: FFBC) is a regional bank headquartered in Cincinnati, Ohio, with its operations center in the northern Cincinnati, Tri-County area. Founded in 1863, First Financial has a state bank charter and has 110 locations in Ohio, Kentucky, and throughout Indiana.
First Financial acquired Irwin Financial Corp and its subsidiaries through a government assisted transaction on September 18, 2009.  As of April 2018, the company had $13 billion in assets and market capitalization of $2.6 billion.The Company's subsidiary, First Financial Bank, N.A., founded in 1863, provides banking and financial services products through its three lines of business: commercial, retail and wealth management. The commercial and retail units provide traditional banking services to business and consumer clients. First Financial Wealth Management provides wealth planning, portfolio management, trust and estate, brokerage and retirement plan services and had approximately $2.5 billion in assets under management as of June 30, 2013."
"275","J.W. Mays, Inc. (NASDAQ: MAYS) is a real estate firm based in Brooklyn, New York, United States. From 1927 until 1988 the company ran a chain of discount department stores in the area surrounding New York City referred to as Mays, with stores located in three of New York City's five boroughs, Long Island, and Putnam County. At its height as a retailer, the firm had 5000 employees working in 9 stores during the early 1970s."
"276","Schnitzer Steel Industries, Inc. is a steel manufacturing and scrap metal recycling company headquartered in Portland, Oregon.
Its Auto and Metals Recycling division collects and recycles autos, rail cars, home appliances, industrial machinery, manufacturing scrap and construction and demolition scrap from bridges, buildings and other infrastructure. It sources from 52 stores which operate under the commercial brand-name Pick-n-Pull. In fiscal 2018, the division recycled and shipped 4.3 million tons of ferrous scrap metal and 636 million pounds of nonferrous scrap metal. In 2018, it sold to customers in 26 countries. The Cascade Steel and Scrap division produces finished steel products such as rebar, wire rod, coiled rebar, merchant bar and other specialty products using nearly 100% recycled metal sourced from the Auto and Metals Recycling division. In fiscal 2016, the division sold 519,000 short tons of finished steel."
"277","Applied Materials, Inc. is an American corporation that supplies equipment, services and software to enable the manufacture of semiconductor (integrated circuit) chips for electronics, flat panel displays for computers, smartphones and televisions, and solar products. The company also supplies equipment to produce coatings for flexible electronics, packaging and other applications. The company is headquartered in Santa Clara, California, in Silicon Valley."
"278","Great Lakes Dredge and Dock Company is an American company providing construction services in dredging and land reclamation, currently the largest such provider in the United States. GLD&D operates primarily in the United States but conducts one-quarter of its business overseas. It is currently based in Oak Brook, Illinois."
"279","Exa Corporation is a developer and distributor of computer-aided engineering (CAE) software. Its main product is PowerFLOW, a lattice-boltzmann derived implementation of computational fluid dynamics (CFD), which can very accurately simulate internal and external flows in low-Mach regimes. PowerFLOW is used extensively in the international automotive and transportation industries."
"280","Dish Network Corporation is a U.S. television provider. Based in Meridian, Colorado, it is the owner of the direct-broadcast satellite provider Dish (stylized DISH, formerly and still commonly known as Dish Network), and the over-the-top IPTV service Sling TV. As of November 2016, the company provided services to 13.7 million television and 580,000 broadband subscribers. The company has approximately 17,000 employees."
"281","Impinj, Inc. is a manufacturer of radio-frequency identification (RFID) devices and software. The company was founded in 2000 and is headquartered in Seattle, Washington. The company was started based on the research done at the California Institute of Technology by Carver Mead and Chris Diorio. Impinj currently produces EPC Class 1, Gen 2 passive UHF RFID chips, RFID readers, RFID reader chips, and RFID antennas, and software applications for encoding chips, and gathering business intelligence on RFID systems."
"282","Funko Inc. is an American company that manufactures licensed pop culture collectibles, best known for its licensed vinyl figurines and bobbleheads. In addition, the company produces licensed plush, action figures, and electronic items such as USB drives, lamps, and headphones.
Founded in 1998 by Mike Becker, Funko was originally conceived as a small project to create various low-tech, nostalgia-themed toys. The company's first manufactured bobblehead was of the well-known restaurant advertising icon, the Big Boy mascot.Sold in 2005, Funko, LLC, is now headed by CEO Brian Mariotti. Since then, the company has increased the scope of its toy lines and signed licensing deals with major companies such as Marvel, DC Comics, Image Comics, Dark Horse Comics, Valiant Comics, WWE, Lucasfilm, Sony Pictures, Paramount Pictures, Nickelodeon, DreamWorks, Hasbro, CBS, Fox, Warner Bros., 20th Century Fox, Disney, HBO, Peanuts Worldwide, BBC, MLB, NFL, Ubisoft, NBCUniversal, Cartoon Network, Netflix, Mattel, World Events Productions, 2K Games, Bethesda Games, Nintendo, The Pokémon Company, Sega, Konami, Bandai Namco Entertainment, Hanna-Barbera, Square Enix, Activision, Capcom, The Jim Henson Company, Sesame Workshop, Scholastic, American Greetings, Toei Company, Tsuburaya Productions, Toho, Blizzard Entertainment, Lionsgate, The Lego Group, Kellogg's, Jollibee, KFC, McDonald's, Burger King (and Hungry Jack's), and General Mills. Its toys and other products now have worldwide distribution."
"283","Partner Communications Company Ltd. (Hebrew: <U+05D7><U+05D1><U+05E8><U+05EA> <U+05E4><U+05E8><U+05D8><U+05E0><U+05E8> <U+05EA><U+05E7><U+05E9><U+05D5><U+05E8><U+05EA> <U+05D1><U+05E2>""<U+05DE><U+200E>) doing business as Partner (Hebrew: <U+05E4><U+05E8><U+05D8><U+05E0><U+05E8><U+200E>), formerly known as Orange Israel (Hebrew: <U+05D0><U+05D5><U+05E8><U+05E0><U+05D2>' <U+05D9><U+05E9><U+05E8><U+05D0><U+05DC><U+200E>), is a mobile network operator, internet Wi-Fi, fixed telephony service and OTT/IPTV provider in Israel. It was formerly operating under the Orange brand name until 16 February 2016.
The company’s shares are traded on NASDAQ and the Tel Aviv Stock Exchange, where it is a constituent of the TA-25 Index; since August 2009, Scailex Corporation (owned by businessman Ilan Ben Dov) controls 51% of its shares."
"284","American Woodmark is a kitchen and bath cabinet manufacturer, headquartered in Winchester, Virginia. The company operates 9 manufacturing facilities, in Arizona, Georgia, Indiana, Kentucky, Maryland, Tennessee, Virginia, and West Virginia, and 9 builder service centers across the country."
"285","Immunomedics is a pharmaceutical company focusing on the development of antibody-drug conjugates for the treatment of cancer.
Immunomedics was founded in July 1982 by David M. Goldenberg, who has served on the board of directors since then. Michael Pehl is the current CEO since December 2017."
"286","Commercial Vehicle Group (CVG) is a global supplier of complete cab systems in the heavy-duty truck, construction and agricultural equipment markets including the specialty and military transportation markets.  The company went public in 2004, the same year they opened their Shanghai facility.  CVG maintains operations in North America, Europe, Asia, and Australia.  CVG employs over 7,000 employees worldwide, and revenues in fiscal year 2013 were $747.7M.


== References =="
"287","Rockwell Medical Inc. is a publicly traded (NASDAQ: RMTI) biopharmaceutical company founded in 1996 in Michigan. Rockwell focuses on development and commercialization of treatments against diseases such as end-stage renal disease (ESRD) and chronic kidney disease (CKD).This company performed top during 2013, among biopharmaceutical companies in the US and has two largest dialysis centers in the US, DaVita (DVA) and Fresenius (FMS), as the buyer of its products."
"288","Avadel Pharmaceuticals plc NASDAQ: AVDL, is a specialty pharmaceutical company that seeks to develop differentiated pharmaceutical products that are safe, effective and easy to take through formulation development, by utilizing its proprietary drug delivery technology and in-licensing / acquiring new products; ultimately, helping patients adhere to their prescribed medical treatment and see better results. Avadel markets products in the hospital and primary care spaces. The Company is headquartered in Dublin, Ireland with operations in St. Louis, Missouri and Lyon, France.The company was founded as Flamel Technologies SA in Lyon, France in 1990.The company acquired Éclat Pharmaceuticals of St. Louis, Missouri in March 2012.On 8 February 2016, the company acquired  FSC Holdings, LLC, which included its wholly owned subsidiaries FSC Pediatrics, Inc., FSC Therapeutics, LLC, and FSC Laboratories, Inc.On 3 January 2017, Flamel, Éclat, and FCS Pediatrics became Avadel Pharmaceuticals plc  after the Company completed a cross-border merger from France to Ireland."
"289","Sterling Bank was a wholly owned subsidiary of Sterling Bancshares, Inc. (NASDAQ: SBIB), of Houston, Texas.  Sterling has total assets of $5 billion and operates 56 banking centers in the greater metropolitan areas of Houston, San Antonio, Dallas, Fort Worth, as well as in the Texas Hill Country. The Bank was founded in 1974 as Jersey Village Bank.
Of the bank's 56 banking centers, 13 are in Dallas and Fort Worth, 29 are in Houston, 8 are in San Antonio, and 5 are in the Texas Hill Country.
On January 18, 2011 Sterling Bank announced it will be acquired by Comerica Bank in a stock swap deal valuing Sterling Bank at over $1 billion."
"290","Avid Technology (often known as Avid, stylized as <U+25B2><U+25BC><U+275A><U+25B6>) is an American technology and multimedia company founded in August 1987 by Bill Warner, based in Burlington, Massachusetts. It specializes in audio and video; specifically, digital non-linear editing (NLE) systems, management and distribution services.
Avid products are now used in the television and video industry to create television shows, feature films, and commercials. Media Composer, a professional software-based non-linear editing system, is Avid's flagship product."
"291","ManTech International Corporation was co-founded in 1968 by George J. Pedersen and Franc Wertheimer. The company uses advanced technology to help government and industry manage and protect information, support and maintain critical systems, and develop integrated systems to handle complex needs. The company name ""ManTech"" was formed by the combination of ""Management"" and ""Technology""."
"292","WesBanco, Inc., is a bank holding company headquartered in Wheeling, West Virginia. It has 177 branches and 163 automatic teller machines in West Virginia, Ohio, Western Pennsylvania, Kentucky, and Southern Indiana.WesBanco is the second-largest bank headquartered in West Virginia, after United Bank. Based on total deposits, it is the third-largest bank operating in West Virginia, after BB&T and United Bank.In addition to banking services, the company offers insurance and investment products.The company owns the naming rights to the WesBanco Arena, home of the Wheeling Nailers hockey team."
"293","Sonos is an American consumer electronics company founded in 2002 by John MacFarlane, Craig Shelburne, Tom Cullen, and Trung Mai, based in Santa Barbara, California. Sonos is widely known for the smart speakers it develops and manufactures.
MacFarlane introduced a prototype at the 2004 Consumer Electronics Show, which was released in 2005 as a bundle called the Digital Music System. The company expanded upon the prototype and product design, adding mesh networking with AES encryption to allow the speakers to play music simultaneously in multiple rooms. Between 2011 and 2014, the company released numerous speakers and added more services. In 2015, they launched a visual rebrand with the help of Bruce Mau Design. The company has partnered with other companies adding to their catalog of services, including Pandora, iHeartRadio, Spotify, MOG, QQ Music, and Amazon Music.
Through a partnership with Amazon, Alexa can control Sonos speakers, with some speaker models incorporating a built in microphone and intending to eventually work with every voice assistant on the market. Sonos expects to add support for Google Assistant in 2019.The company opened its own local studio and art museum, the Sonos Studio, in May 2011 as well as an official Sonos Store in SoHo in July 2016."
"294","Telenav, Inc. (NASDAQ: TNAV) is a wireless location-based services corporation that provides services including Global Positioning System (GPS) satellite navigation, local search, automotive navigation solutions, mobile advertising, enterprise mobility and workflow automation. The company’s headquarters are located in Santa Clara, California in the United States with additional offices in the U.S., Germany, Japan, Romania, China, and Brazil."
"295","Avalanche Biotechnologies is a publicly traded (NASDAQ:AAVL) biotechnology company in the NASDAQ Biotechnology Index that is focused on diseases of the eye. This includes macular degeneration, retinal vein occlusion, diabetic macular edema, and others. The company's only drug in clinical trials, AVA-101, designed to treat macular degeneration, had poor results after initial clinical trials in 2015. In 2016 Avalanche Biotechnologies merged with Annapurna Therapeutics to form Advertum Biotechnologies, Inc.


== References =="
"296","Cellectis is a French biopharmaceutical company. It develops genome-edited chimeric antigen receptor T-cell technologies for cancer immunotherapy. It has offices in Paris and New York City."
"297","Stericycle is a compliance company that specializes in collecting and disposing regulated substances, such as medical waste and sharps, pharmaceuticals, hazardous waste, and providing services for recalled and expired goods. It also provides related education and training services, and patient communication services. The company was founded in 1989 and is headquartered in Lake Forest, Illinois, with many more bases of operation around the world, including toxic waste incinerators in Utah and North Carolina.
Stericycle has been harshly criticized by residents living near their incinerators and environmentalists across the globe. Currently, Stericycle is being investigated by the state of Utah for burning hazardous, radioactive waste above legal levels at their North Salt Lake location. The investigations also are in response to Stericycle's alleged falsification of records to hide the alleged illegal quantity burning near Foxboro Elementary in North Salt Lake.Stericycle, Inc., together with its subsidiaries, offers regulated waste management services, sharps disposal containers to reduce the risk of needlesticks, healthcare compliance services, pharmaceutical disposal, and regulated returns management services for expired or recalled products through incineration processes.
The company serves healthcare facilities such as hospitals, blood banks, pharmaceutical manufacturers,. Stericycle also serves myriad small businesses, which include outpatient clinics, medical and dental offices, abortion clinics, veterinary and animal hospitals, funeral homes, home healthcare agencies, body art studios, and long-term and sub-acute care facilities. Medical device manufacturers, consumer goods manufacturers, and retailers are also key customers."
"298","Dollar Tree Stores, Inc., formerly known as Only $1.00, is an American chain of discount variety stores that sells items for $1 or less. Headquartered in Chesapeake, Virginia, it is a Fortune 500 company and operates 14,835 stores throughout the 48 contiguous U.S. states and Canada. Its stores are supported by a nationwide logistics network of eleven distribution centers. The company operates one-dollar stores under the names of Dollar Tree and Dollar Bills. The company also operates a multi-price-point variety chain under Family Dollar.
Dollar Tree competes in the dollar store and low-end retail markets. Each Dollar Tree stocks a variety of products including national, regional, and private-label brands. Departments found in a Dollar Tree store include health and beauty, food and snacks, party, seasonal décor, housewares, glassware, dinnerware, household cleaning supplies, candy, toys, gifts, gift bags and wrap, stationery, craft supplies, teaching supplies, automotive, electronics, pet supplies, and books. Most Dollar Tree stores also sell frozen foods and dairy items such as milk, eggs, pizza, ice cream, frozen dinners, and pre-made baked goods. In August 2012, the company began accepting manufacturer's coupons at all of its store locations."
"299",""
"300","Odyssey Marine Exploration, Inc. is an American company engaged in the salvage of deep-water shipwrecks.  Odyssey salvaged the U.S. Civil War era shipwreck of the SS Republic in 2003 and recovered over 50,000 coins and 14,000 artifacts from the site nearly 1,700 feet deep. Odyssey has several shipwreck projects in various stages of development around the world, including the codenamed Black Swan Project."
"301","First Solar, Inc. is an American photovoltaic (PV) manufacturer of rigid thin film modules, or solar panels, and a provider of utility-scale PV power plants and supporting services that include finance, construction, maintenance and end-of-life panel recycling. First Solar uses cadmium telluride (CdTe) as a semiconductor to produce CdTe-panels, that are able to compete with conventional crystalline silicon technology. In 2009, First Solar became the first solar panel manufacturing company to lower its manufacturing cost to $1 per watt and produced CdTe-panels with an efficiency of about 14 percent at a reported cost of 59 cents per watt in 2013.The company was founded in 1990 by inventor Harold McMaster as Solar Cells, Inc. and the Florida Corporation in 1993 with JD Polk. In 1999 it was purchased by True North Partners, LLC, who rebranded it as First Solar, Inc. The company went public in 2006, trading on the NASDAQ. Its current chief executive is Mark Widmar, who succeeded the previous CEO James Hughes July 1, 2016.  First Solar is based in Tempe, Arizona. 
As of 2010, First Solar was considered the second-largest maker of PV modules worldwide and ranked sixth in Fast Company's list of the world's 50 most innovative companies.In 2011, it ranked first on Forbes's list of America's 25 fastest-growing technology companies. It is listed on the Photovoltaik Global 30 Index since the beginning of this stock index in 2009. The company was also listed as No. 1 in Solar Power World magazine's 2012 and 2013 rankings of solar contractors."
"302","Sykes Enterprises, Incorporated (stylized as SYKES) is an American multinational corporation headquartered in Tampa, Florida. The company provides business process outsourcing services, IT consulting and IT-enabled services, such as technical support and customer service."
"303","Dropbox is a file hosting service operated by the American company Dropbox, Inc., headquartered in San Francisco, California, that offers cloud storage, file synchronization, personal cloud, and client software. Dropbox was founded in 2007 by MIT students Drew Houston and Arash Ferdowsi as a startup company, with initial funding from seed accelerator Y Combinator.
Dropbox has received praise, including the Crunchie Award in 2010 for Best Internet Application, and Macworld's 2009 Editor's Choice Award for Software. It has been ranked as one of the most valuable startups in the US and the world, with a valuation of over US$10 billion, and it has been described as one of Y Combinator's most successful investments to date. However, Dropbox has also experienced criticism and generated controversy for issues including security breaches and privacy concerns.
Dropbox has been blocked in China since 2014.  It has a five star privacy rating from the Electronic Frontier Foundation."
"304","Golden Ocean Group is a Bermuda registered, Norway based dry bulk shipping company. The company was created as a demerged part of Frontline in 2004 and listed on the Oslo Stock Exchange. 40.3% of the company is indirectly owned by John Fredriksen, through Hemen Holding.
The fleet consists of 24 owned vessels (20 under construction), 22 chartered vessels (7 with purchase options), 7 bare boat vessels (all with purchase options), 10 vessels under commercial management (8 ore-bulk-oil carrier, two capesizes under construction) and 9 sold up on yard delivery. 16 of these are capesize while 56 are panamax, of which 1 capesize and 8 panamaxes are sold when delivered from yard.
Management of the fleet is carried out by the Norwegian company Golden Ocean Group Management AS led by Herman Billung."
"305","Ultralife Corporation (NASDAQ: ULBI) designs and manufactures batteries and communications systems worldwide. Ultralife serves government and defense, medical, safety and security, energy, robotics and other customers across the globe through the design and development of a range of products. Founded in 1991 and headquartered in Newark, New York, the Company’s business segments include battery and energy products and communications systems."
"306","Itron is a US technology company that offers products and services on energy and water resource management. Its headquarters is in Liberty Lake, Washington, United States. Its products and services include technology solutions related to smart grid, smart gas and smart water that measure and analyze electricity, gas and water consumption. Its products include electricity, gas, water and thermal energy measurement devices and control technology; communications systems; software; as well as managed and consulting services. Itron has over 8,000 customers in more than 100 countries."
"307","Bravo Brio Restaurant Group is the parent company of the Bravo! Cucina Italiana, Brio Tuscan Grille, restaurant chains in the United States. The company owns more than 118 restaurants in 33 states. It was established in 1992 by Rick and Chris Doody in collaboration with Executive Chef Phil Yandolino and is based in Columbus, Ohio. Brad Blum is the company's chief executive officer and chairman. Brio specialized in Northern Italian cuisine including bruschetta, flatbread pizzas, pasta, steaks, seafood, soup and salad. Bravo! restaurants have a Roman ruin style décor and an open, Italian style kitchen focusing primarily on pastas and pizzas. The company's goal is to be the ""Best Italian"" restaurant company in America."
"308","Endo International plc is an Irish–tax registered generics and specialty branded pharmaceutical company that generated over 93% of 2017 sales from the U.S. healthcare system.  While Endo's management, operations, and customers are almost exclusively U.S.–based, in 2013 Endo executed a corporate tax inversion to Ireland to avoid U.S. corporate taxes on their U.S. drug sales, and to avail of Ireland's corporate tax system."
"309","NETSCOUT Systems, Inc. (NASDAQ: NTCT) is a provider of application and network performance management products. Headquartered in Westford, Massachusetts, NETSCOUT serves enterprises community, government agencies and telecommunications service providers.In July 2015, NETSCOUT acquired the communications business of  Danaher Corporation, including Arbor Networks, Fluke Networks,  Tektronix Communications and VSS Monitoring."
"310","Extreme Networks is a networking company based in San Jose, California. Extreme Networks designs, develops, and manufactures wired and wireless network infrastructure equipment and develops the software for network management, policy, analytics, security and access controls."
"311","EverQuote is an online insurance marketplace and lead generation service  founded in 2011 and headquartered in Cambridge, Massachusetts."
