"","x"
"514","Urban One, Inc. (formerly Radio One) is a Silver Spring, Maryland-based American media conglomerate. Founded in 1980 by Cathy Hughes, the company primarily operates media properties targeting African Americans. It is the largest African-American-owned broadcasting company in the United States, operating 55 radio stations and majority-owning the syndicator Reach Media, as well as its digital arm Interactive One, and the cable network TV OneAs of 2014, it was the ninth-highest-earning African-American-owned business in the United States."
"515","Lovesac is an American furniture retailer, specializing in a patented modular furniture system called Sactionals. Sactionals consist of two combinable pieces, “Seats” and “Sides,” as well as custom-fit covers and associated accessories. Lovesac also sells Sacs, a beanbag filled with a proprietary foam mixture."
"516","Acura Pharmaceuticals Inc. is a pharmaceutical company focused on the development and commercialization of deterrents to medication abuse and misuse.  As of 2012, the company had several opioid products under development, which would use ""Aversion Technology"".  As of 2014, the company was a publicly traded company, listed on NASDAQ under the symbol ""ACUR""."
"517","DavidsTea (often stylized as DAVIDsTEA) (in French Les Thés DavidsTea) is a Canadian specialty tea and tea accessory retailer based in Montreal, Quebec.  It is the largest Canadian-based specialty tea boutique in the country. Following the company's initial public offering, common stock began trading on the NASDAQ Global Market on June 5, 2015.
The company now offers stores in over 240 locations throughout Canada and the United States."
"518","SSR Mining Inc., formerly Silver Standard Resources, is a Vancouver-based mining company focused on the operation, development, exploration and acquisition of precious metal projects. It is listed under the ticker symbol SSRM on the NASDAQ Capital Markets and the Toronto Stock Exchange.
SSR Mining is a precious metals producer with three operations, including the Marigold gold mine in Nevada, U.S., the Seabee Gold Operation in Saskatchewan, Canada and the 75% owned and operated Puna Operations joint venture in Jujuy Province, Argentina. Puna Operations consists of the Pirquitas operation and the Chinchillas development project.
SSR Mining has two feasibility stage projects and a portfolio of exploration properties throughout North and South America."
"519","Zix Corporation (ZixCorp) (NASDAQ: ZIXI) is a security technology company that provides email encryption services, email data loss prevention (DLP) and mobile applications designed to address bring your own device (BYOD) corporate technology trend. Headquartered in Dallas, Texas, the company  serves customers that include divisions of the U.S. Treasury, federal financial regulators, health insurance providers and hospitals, and financial companies. As of December 2011, the company has served over thirty Blue Cross Blue Shield organizations, 1,200 hospitals, 1,600 banks, credit unions and associations. Federal Financial Institutions Examination Council (FFIEC) regulators are also the customers of the company. CIPROMS has signed a three-year renewal for the company in 2014.The company generates money based on a software-as-a-service (SaaS) strategy and charge annual fees from its customers. ZixCorp was founded in 1983. The company operates its service supported by ZixData Center, a data center storing transaction processing data. In 2002, the company changed its name from Zixlt Corporation to Zix Corporation.In 2017, Zix acquired Greenview Data for $6.5 million."
"520","Hologic, Inc. is a medical technology company primarily focused on women’s health and beauty; it sells medical devices for surgery and medical imaging.
In late November 2013, activist investor Carl Icahn disclosed a 12.5% stake in the company.  Subsequently, the company adopted a poison pill to prevent a hostile takeover.  In negotiations with the Company's board of directors, two additional directors backed by Mr. Icahn were added to the board, each managing directors of Icahn holding companies."
"521","Regeneron Pharmaceuticals, Inc. is an American biotechnology company headquartered in Eastview, near Tarrytown, New York. The company was founded in 1988.  Originally focused on neurotrophic factors and their regenerative capabilities (thus the name), it branched out into the study of both cytokine and tyrosine kinase receptors."
"522","Tuesday Morning Corporation is an American discount, off-price retailer specializing in domestic and international, designer and name-brand closeout merchandise. The company has stores across the United States. Headquartered in Dallas, Texas, the chain traditionally has relied on direct marketing (including mail and e-mail), but also advertises in newspapers."
"523","Mackinac Financial Corporation is a Manistique, Michigan-based bank holding company for Michigan bank mBank. It provides commercial and retail banking products and services and was incorporated on December 16, 1974. The company's common stock is traded on the NASDAQ stock market under the symbol of “MFNC.”"
"524",""
"525","Costco Wholesale Corporation, doing business as Costco, is an American multinational corporation which operates a chain of membership-only warehouse clubs. As of 2015, Costco was the second largest retailer in the world after Walmart, and as of 2016, Costco was the world's largest retailer of choice and prime beef, organic foods, rotisserie chicken, and wine. Costco is ranked #15 on the Fortune 500 rankings of the largest United States corporations by total revenue.Costco's worldwide headquarters are in Issaquah, Washington, a suburb east of Seattle; the company opened its first warehouse in Seattle 36 years ago in 1983. Through mergers, Costco's corporate history dates back to 1976, when its former competitor Price Club was founded in San Diego, California. As of March 7, 2019, Costco had a total of 770 warehouses: 531 in the United States and 4 in Puerto Rico, 100 in Canada, 39 in Mexico, 28 in the United Kingdom, 26 in Japan, 15 in South Korea, 13 in Taiwan, 10 in Australia, 2 in Spain, and 1 in Iceland and France."
"526","Steel Dynamics, Inc., sometimes abbreviated as ""SDI"", is a steel producer based in Fort Wayne, Indiana.
With a production capacity of 11.35 million tons, Steel Dynamics is the 3rd largest producer of carbon steel products in the United States. SDI is among the most profitable American steel companies in terms of profit margins and operating profit per ton.The company is ranked 312th on the Fortune 500."
"527","Take-Two Interactive Software, Inc. is an American video game holding company based in New York City. The company owns two major publishing labels, Rockstar Games, and 2K, itself composed of two divisions: 2K Games and 2K Sports, all of which own and operate various game development studios. Take-Two's portfolio includes numerous successful video game series across personal computer and video game consoles, including BioShock, Borderlands, Civilization, Grand Theft Auto, NBA 2K, Red Dead, and XCOM. As of March 2018, it is the third-largest publicly traded game company in the Americas and Europe after Activision Blizzard and Electronic Arts, with an estimated market cap of US$13 billion.Take-Two was founded by Ryan Brant in September 1993, looking to become a major publisher in the video game area. The company went public in April 1997, and later acquired the publisher and developer behind Grand Theft Auto, through which it formed Rockstar Games and Rockstar North, respectively, and also leading to their long-standing ""label"" structure. From 2003 to 2005, the company fell under investigation by the Security and Exchange Commission related to corporate and personal financial fraud after going public that led to Brant resigning by 2006 alongside the departures of other former executives and board members. As a result of this mismanagement, the company's majority shareholders led a takeover of Take-Two in March 2007, replacing them with Strauss Zelnick as the new Chairman and CEO. Take-Two subsequently rejected a US$1.9 billion buy-out from Electronic Arts in 2008. Since then, the company has continued to grow through acquisitions and creation of new studios. More recently, Take-Two created the label Private Division to support publishing from independent developers, and acquired the developer Social Point to establish itself in the mobile game market. The company also owns 50% of professional esports organization NBA 2K League."
"528","Camden National Bank is a bank headquartered in Camden, Maine, with 61 branches, all of which are in Maine. It is a subsidiary of Camden National Corporation, a bank holding company. It is the largest bank headquartered in Maine."
"529","Electra Meccanica Vehicles Corporation is a Canadian manufacturer of electrically-powered microcars headquartered in Vancouver, British Columbia. The company was established in 2015 by Henry Reisner of Intermeccanica and Jerry Kroll, a former race-car driver and the former CEO of CRAiLAR Technologies.Electra Meccanica vehicles are assembled from Chinese parts in New Westminster, British Columbia. Retail stores are located in Vancouver, British Columbia, and in Los Angeles, California, with plans for expansion across major cities in the US and around the world."
"530","Medpace (alt. MedPace) is a midsize, clinical contract research organization (CRO) based in Cincinnati, Ohio.Medpace provides services for Phase I-IV of drug and medical device development services including regulatory services and central laboratory services.
In February 2014, Medpace was sold to private equity firm Cinven by CCMP Capital for around $900 million.On August 11, 2016 Medpace (MEDP) went public with an IPO consisting of 8,050,000 shares."
"531","Bruker Corporation is an American manufacturer of scientific instruments for molecular and materials research, as well as for industrial and applied analysis. It is headquartered in Billerica, Massachusetts and is the publicly traded parent company of Bruker Scientific Instruments (Bruker AXS, Bruker BioSpin, Bruker Daltonics and Bruker Optics) and Bruker Energy & Supercon Technologies (BEST) divisions.
In April 2010, Bruker created a Chemical Analysis Division (headquartered in Fremont, CA) under the Bruker Daltonics subsidiary. This division contains three former Varian product lines: ICPMS systems, laboratory gas chromatography (GC), and GC-triple quadrupole mass spectrometer (originally designed by Bear Instruments and acquired by Varian in 2001).
In 2012 it sponsored the Fritz Feigl Prize, and since 1999 the company has also sponsored the Günther Laukien Prize."
"532","ON Semiconductor is a Fortune 500 semiconductors supplier company. Products include power and signal management, logic, discrete, and custom devices for automotive, communications, computing, consumer, industrial, LED lighting, medical, military/aerospace and power applications. ON Semiconductor runs a network of manufacturing facilities, sales offices and design centers in North America, Europe, and the Asia Pacific regions. Headquartered in Phoenix, Arizona, ON Semiconductor has revenues of $3.907 billion (2016), which puts it among the worldwide top 20 semiconductor sales leaders."
"533","RealNetworks, Inc. is a provider of Internet streaming media delivery software and services based in Seattle, Washington, United States. The company also provides subscription-based online entertainment services and mobile entertainment and messaging services."
"534","Walgreens Boots Alliance, Inc. is an American holding company headquartered in Deerfield, Illinois, that owns Walgreens, Boots, and a number of pharmaceutical manufacturing, wholesale, and distribution companies. The company was formed on December 31, 2014, after Walgreens purchased the 55% stake in UK and Switzerland-based Alliance Boots that it did not already own. The total price of the acquisition was $4.9 billion in cash and 144.3 million common shares with fair value of $10.7 billion. Walgreens had previously purchased 45% of the company for $4.0 billion and 83.4 million common shares in August 2012 with an option to purchase the remaining shares within three years. Walgreens became a subsidiary of the newly created company after the transactions were completed.The company is organized into three divisions: Retail Pharmacy USA (Walgreens and Duane Reade),
Retail Pharmacy International (Boots and other retail operations internationally), and Pharmaceutical Wholesale, incorporating Alliance Healthcare. The new holding company began trading on the NASDAQ on December 31, 2014.The combined business has operations in over 25 countries.  Walgreens had formerly operated solely within the United States and its territories, while Alliance Boots operated a more international business.
In October 2018, Walgreens Boots Alliance published its fourth quarter earnings report. Fiscal year 2018 sales were $131.5 billion, up 11.3% from fiscal 2017, and GAAP net earnings increased to $5.0 billion.On June 26, 2018, Walgreens Boots Alliance replaced General Electric on the Dow Jones Industrial Index."
"535","DSP Group, Inc. is a provider of chipsets for VoIP, multimedia, and digital cordless applications. Founded in 1987 with headquarters in San Jose, California, DSP Group employs over 400 people at three US sites and offices in Germany, Scotland, Israel, India, Hong Kong and Japan."
"536","Check Point is a multinational provider of software and combined hardware and software products for IT security, including network security, endpoint security, cloud security, mobile security, data security and security management.
As of 2016 the company has approximately 4,000 employees worldwide. Headquartered in Tel Aviv, Israel and San Carlos, California, the company has development centers in Israel, United States (ZoneAlarm), Sweden (Former Protect Data development centre), and Belarus. The company has main offices in North America, two in the United States (San Carlos, California and Dallas, Texas) and Ottawa, Ontario, Canada."
"537","Nature's Sunshine Products, Incorporated (NASDAQ: NATR), also known as ""NSP"", is a manufacturer and multi-level marketer of dietary supplements, including herbs, vitamins, minerals, and personal care products. It is based in Lehi, Utah, with a manufacturing facility in Spanish Fork, Utah."
"538","Canterbury Park (NASDAQ: CPHC) (formerly Canterbury Downs), is a horse racing track in Shakopee, Minnesota, USA. It runs a meet that consists of about 70 racing days from early May to mid-September, generally holding scheduled races Thursday through Sunday, with racing added on several holidays throughout the meet. The track itself features a one-mile (1,600 m) oval dirt track and a seven-furlong (1,400 m) turf course. Outside seating is available along with several indoor seating options. The track runs multiple food stands and bars throughout the building and simulcast betting is also offered.
Canterbury Park has hosted the Claiming Crown of horse racing for all but four years since its inception in 1999.
The inaugural Mystic Lake Derby, offering the largest purse at the track since 1991, was run on July 28, 2012.  The race was won by the 3-year-old Hammers Terror in a time of 1:37.18 over the one mile turf event.The park also includes a card club. A two-week series of poker tournaments, Fall Poker Classic, is held each fall at Canterbury Park."
"539","Park City Group, Inc. (NASDAQ: PCYG) was established in 1990 and now is headquartered in Salt Lake City, Utah. The company focuses on software-as-a-service (SaaS) for the suppliers and retailers in the whole supply chain, reducing out-of-stocks, optimizing inventory, and improving profits and operational efficiencies. In the year of 2009, the company acquired Prescient Applied Intelligence to form ""The New"" Park City Group. In 2013, the company moved trading in its shares from the NYSE, formerly the American Stock Exchange, to the NASDAQ Capital Market."
"540","Icahn Enterprises L.P. is an American conglomerate headquartered at the General Motors Building in New York City. The company has investments in various industries including auto parts, energy, metals, rail cars, casinos, food packaging, real estate, and home fashion. The company is controlled by Carl Icahn, who owns 95% of it."
"541","West Corporation is a private telecommunications services provider based in Omaha, Nebraska. It became a subsidiary of Apollo Global Management on October 11, 2017."
"542","BankFinancial, FSB, based in Olympia Fields, Illinois is a federal savings bank.  BankFinancial currently has 19 branch locations in addition to their corporate headquarters.
BankFinancial Corporation is the holding company for BankFinancial, FSB, a full service, community-oriented bank providing financial services to individuals, families and businesses through 19 full service banking offices, located in Cook, DuPage, Lake and Will Counties, Illinois. At March 31, 2013, BankFinancial had total assets of $1.466 billion, total loans of $1.004 billion, total deposits of $1.272 billion and stockholders’ equity of $174 million. BankFinancial Corporation’s common stock trades on the Nasdaq Global Select Market under the symbol BFIN."
"543","Office Depot, Inc. is an American office supply retailing company headquartered in Boca Raton, Florida, United States. The company has combined annual sales of approximately $11 billion, and employs about 38,000 associates with businesses in the United States. The company operates 1,400 retail stores, e-commerce sites and a business-to-business sales organization.
The company's portfolio of brands includes Office Depot, OfficeMax, Grand & Toy, Ativa, TUL, Foray, Realspace, and DiVOGA."
"544","ClearSign Combustion (ClearSign) is a United States-based company that develops emission-control technology."
"545","The Meet Group, Inc. (formerly MeetMe) (NASDAQ: MEET) is a social entertainment service founded in 2005. In 2011, myYearbook merged with Quepasa Corporation (QPSA: NYSE Amex).  In June 2012, the combined company was renamed MeetMe, Inc. In April 2014, MeetMe rebranded to The Meet Group, Inc. and shares started trading on the NASDAQ Capital Market under the ticker symbol ""MEET.""
The Company is a portfolio of mobile social entertainment apps designed to meet the universal need for human connection. Its primary apps are MeetMe©, LOVOO©, Skout©, and Tagged©. The Company has millions of mobile daily active users. Its apps are available on iPhone, iPad, and Android in multiple languages. Through these apps, users can stream live video, send gifts, chat, and share photos. The Meet Group derives revenue from in-app purchases, subscriptions, and advertising. The Company has offices in New Hope, Philadelphia, San Francisco, Dresden, and Berlin."
"546","Career Education Corporation (CECO) is a for-profit postsecondary higher education provider with campus-based and online programs, headquartered in Schaumburg, Illinois. The company's schools offer associate, bachelor's, master's, doctoral, and certificate programs in career-focused disciplines.
The organization will close most of its 50 campuses in the United States as the corporation downsizes to two primarily online brands: American InterContinental University and Colorado Technical University.In 2016, Career Education Corporation had about 43,000 students. However, approximately 9,400 students came from schools that are shutting down.  According to a 2014 US Senate Health, Education, Labor, and Pensions report, 48% of Career Education's programs would have failed or been at risk of failing the US Department of Education's new ""gainful employment"" standards."
"547","Viacom Inc. ( VY-<U+0259>-kom or  VEE-<U+0259>-kom) is an American multinational mass media conglomerate company with interests primarily in film and television. It is currently the world's ninth largest media company in terms of revenue, and has headquarters in New York City. Voting control of Viacom is held by National Amusements, Inc., a privately owned theater company controlled by billionaire Sumner Redstone, who also holds a controlling stake in CBS Corporation.The present-day Viacom was created as a spin-off from the original company, which was renamed as CBS Corporation afterwards, on December 31, 2005. The latter currently retains control of the over-the-air broadcasting, TV production, subscription pay television, and publishing assets, which were previously owned by the original Viacom. Comprising Viacom Media Networks and Paramount Pictures, Viacom operates approximately 170 networks, reaching approximately 700 million subscribers in approximately 160 countries."
"548","Vodafone Group plc  is a British multinational telecommunications conglomerate with headquarters in London and Newbury, Berkshire. It predominantly operates services in the regions of Asia, Africa, Europe, and Oceania. Among mobile operator groups globally, Vodafone ranked 4th (behind China Mobile, Bharti Airtel and Vodafone Idea) in the number of mobile customers (313 million) as of 2018.Vodafone owns and operates networks in 25 countries, and has partner networks in 47 further countries. Its Vodafone Global Enterprise division provides telecommunications and IT services to corporate clients in 150 countries.Vodafone has a primary listing on the London Stock Exchange and is a constituent of the FTSE 100 Index. It had a market capitalisation of approximately £52.5 billion as of 10 February 2016, the eighth-largest of any company listed on the London Stock Exchange. The company has a secondary listing on NASDAQ."
"549","Radware  is a provider of load balancing and cybersecurity services for data centers. Radware's corporate headquarters are located in Mahwah, New Jersey and international headquarters are located in Tel Aviv, Israel. The company also has offices in Shanghai, China. Radware is a member of the Rad Group of companies and its shares are traded on NASDAQ."
"550","Alphabet Inc. is an American multinational conglomerate headquartered in Mountain View, California. It was created through a corporate restructuring of Google on October 2, 2015, and became the parent company of Google and several former Google subsidiaries. The two founders of Google assumed executive roles in the new company, with Larry Page serving as CEO and Sergey Brin as president.The establishment of Alphabet was prompted by a desire to make the core Google Internet services business ""cleaner and more accountable"" while allowing greater autonomy to group companies that operate in businesses other than Internet services."
"551","Ameris Bancorp is an American financial holding company headquartered in Jacksonville, Florida. Ameris provides retail and commercial banking services to its customers in Georgia, Alabama, Florida, South Carolina and Tennessee through its wholly owned subsidiary Ameris Bank. Ameris Bancorp was incorporated on December 18, 1980 as ABC Holding Company to act as parent company to American Banking Company. As of December 31, 2015, Ameris had approximately $5.59 billion in total assets, $4.02 billion in total loans, $4.88 billion in total deposits and $514.8 million in stockholder equity."
"552","Flex Ltd. (previously known as Flextronics International Ltd. or Flextronics) is an American multinational technological manufacturer. It is the third largest global electronics manufacturing services (EMS), original design manufacturer (ODM) company by revenue, behind only Taiwan's Pegatron to original equipment manufacturers. Flex's corporate headquarters are located in Singapore, and its administrative headquarters are in San Jose, California. The company has manufacturing operations in over 40 countries, totalling about 200,000 employees."
"553","Noodles & Company is an American fast-casual restaurant that offers international and American noodle dishes and pasta in addition to as well as soups and salads. Noodles & Company was founded in 1995 by Aaron Kennedy and is headquartered in Broomfield, Colorado. The company went public in 2013 and recorded a $457 million revenue in 2017. In late 2018, there were 460 Noodles & Company locations across 29 states and Washington, D.C."
"554","Zynga Inc.  is an American social game developer running social video game services founded in April 2007 and headquartered in San Francisco, California, United States. The company primarily focuses on mobile and social networking platforms. Zynga states its mission as ""connecting the world through games.""Zynga launched its best-known game, FarmVille, on Facebook in June 2009, reaching 10 million daily active users (DAU) within six weeks. As of August 2017, Zynga had 30 million monthly active users (MAU). In 2017 its most successful games were Zynga Poker, Words With Friends 2, with about 57 million games being played at any given moment, and CSR Racing 2, the most popular racing game on mobile devices.Zynga began trading on NASDAQ December 16, 2011 under the ticker ZNGA."
