"","x"
"1","Primoris Services Corporation is a publicly traded specialty construction and infrastructure company, with a particular focus on pipelines for natural gas, wastewater and water. As of 2014 it was a Fortune 1000 company."
"2","Dunkin' Brands Group, Inc. is an American restaurant holding company which runs two chains of fast-food restaurants: Dunkin' Donuts and Baskin-Robbins. It is headquartered in Canton, Massachusetts."
"3","Werner Enterprises, Inc. (NASDAQ: WERN) is an American freight carrier and transportation and logistics company headquartered in Omaha, Nebraska.  It was founded in 1956 by Executive Chairman,  Clarence L. (C.L.) Werner. He started his business with one truck at the age of 19. The company has two divisions - Truckload Transportation Services and Werner Logistics. At the end of 2017, Truckload division has 7,435 trucks and Werner Logistics has 45 drayage trucks.C.L. Werner, the company's founder and first driver, stepped down from the position of chief executive officer as part of the planned management transition announced in August 2015 and will remain as executive chairman of the company. Derek Leathers was promoted to president and CEO in May 2016.Werner ships throughout the United States, Canada, Mexico, Asia, Europe, South America, Africa and Australia. It has a fleet of 7,400 trucks and more than 24,000 trailers. In 2015, their net profit was estimated as being $123.7 million.Werner has terminals located in 11 states.
It offers van, flatbed and temperature-controlled services.
It has regional offices throughout North America, China and Australia.
Werner’s current fleet is made up of the following makes and models:

Freightliner Cascadia Evolution
Peterbilt 579
Kenworth T680
Volvo VNL 670
International Pro star"
"4","Commvault is a publicly traded data protection and information management software company headquartered in Tinton Falls, New Jersey. It was formed in 1988 as a development group in Bell Labs, and later became a business unit of AT&T Network Systems. It was incorporated in 1996.Commvault software can be used for data backup and recovery, cloud and infrastructure management, and retention and compliance."
"5","Akamai Technologies, Inc. is an American content delivery network (CDN) and cloud service provider headquartered in Cambridge, Massachusetts, in the United States. Akamai's content delivery network is one of the world's largest distributed computing platforms, responsible for serving between 15% and 30% of all web traffic.
The company operates a network of servers around the world and rents out capacity on these servers to customers who want their websites to work faster by distributing content from locations close to the user. When a user navigates to the URL of an Akamai customer, their browser is redirected to one of Akamai's copies of the website."
"6","Pacific Sunwear of California Inc., branded as PacSun, is a United States-based retail clothing brand rooted in the youth oriented culture and lifestyle of California. The company sells lifestyle apparel, along with footwear and accessories designed for teens and young adults. As of late 2017, the company operated over 600 stores in all 50 states and Puerto Rico. PacSun is headquartered in Anaheim, California, and operates a distribution center in Olathe, Kansas. The company's regional directors, district managers and store positions are located throughout the United States. The company went bankrupt in April 2016 and is now owned by Golden Gate Capital. This was the company's third time filing bankruptcy."
"7","Aerie Pharmaceuticals Inc. (NASDAQ: AERI) is a publicly traded, clinical-stage pharmaceutical company focused on the discovery, development and commercialization of first-in-class therapies for the treatment of patients with glaucoma and other diseases of the eye. Aerie's two lead product candidates are once-daily IOP-lowering therapies with novel mechanisms of action to treat patients with glaucoma or ocular hypertension."
"8","Northern Trust Corporation is a financial services company headquartered in Chicago, Illinois that caters to corporations, institutional investors, and high net worth individuals. It is one of the largest banks in the United States and one the oldest banks in continuous operation. As of December 31, 2018, it had $1.07 trillion in assets under management and $10.13 trillion in assets under custody.The company has offices in 20 US states and locations across 23 countries in Canada, Europe, the Middle East and the Asia-Pacific region. It is ranked 486th on the Fortune 1000 as of February 2019."
"9","Expedia Group is an American global travel technology company. Its websites, which are primarily travel fare aggregators and travel metasearch engines, include CarRentals.com, CheapTickets, Expedia.com, HomeAway, Hotels.com, Hotwire.com, Orbitz, Travelocity, trivago, and Venere.com.According to Rich Barton, the company's first CEO, the word ""Expedia"" is derived from a combination of exploration and speed."
"10","Opera Software AS is a Chinese-owned software company, primarily known for its desktop Opera web browser, and mobile web browser Opera Mini. It was demerged from its parent company Otello Corporation as part of the latter's divestiture of its web browser business. Opera browsers have more than 350 million users worldwide across multiple platforms.Opera is also involved in promoting Web standards through participation in the W3C. The company has its headquarters in Oslo, Norway and also has offices in Sweden, Poland, China, Japan, South Korea, Australia, Russia, Ukraine, Iceland, Singapore, Taiwan and the United States.The company changed ownership when Otello (at the time Opera Software ASA) sold its web browser and consumer businesses along with the Opera brand to a Chinese group of investors in 2016 with the deal completing in November of that year.On July 27, 2018, Opera Software went public on the NASDAQ stock exchange, raising $115 million in its initial public offering."
"11","BioMarin Pharmaceutical Inc. is an American biotechnology company headquartered in San Rafael, California. It has offices and facilities in the United States, South America, Asia, and Europe. BioMarin's core business and research is in enzyme replacement therapies (ERTs). BioMarin was the first company to provide therapeutics for mucopolysaccharidosis type I (MPS I), by manufacturing laronidase (Aldurazyme, commercialized by Genzyme Corporation).  BioMarin was also the first company to provide therapeutics for phenylketonuria (PKU).In 2019 it was revealed by multiple news sources  that BioMarin had refused to give the medicine to the people who had successfully tested Kuvan for BioMarin's commercial benefit. One such test patient, Louise Moorhouse, has even had to go back to being permanently disabled by PKU."
"12","Headquartered in California, California First National Bancorp is a registered financial holding company for California First National Bank and California First Leasing Corp. The company currently operates with two primary businesses including an FDIC-insured national bank and a leading leasing company specializing in financing high-technology capital assets.  The company offers various leasing and banking services including leasing and financing capital assets, leasing non-high technology property,accepting various deposit products and various commercial loans for corporations, companies, educational institute and other social organizations."
"13","MINDBODY Inc NASDAQ: MB was founded in 2001. It provides cloud-based business management software for the wellness services industry. MINDBODY serves about 35 million consumers located in over 130 countries and territories. It provides business management software and online scheduling platforms for over 58,000 health and wellness businesses globally. The company's clients include Bikram Yoga and New York Health & Racquet Club. ClassPass is one of MINDBODY's technology partners using MINDBODY's API to power the inventory on the ClassPass app. According to Institutional Venture Partners, MINDBODY is the largest global provider of online business management software to the beauty, health and wellness industry."
"14","JD.com, Inc. (Chinese: <U+4EAC><U+4E1C>; pinyin: Jingdong), also known as Jingdong and formerly called 360buy, is a Chinese e-commerce company headquartered in Beijing. It is one of the two massive B2C online retailers in China by transaction volume and revenue, a member of the Fortune Global 500 and a major competitor to Alibaba-run Tmall. As of the first quarter of 2018, the platform has 301.8 million active users. JD.com, Inc. was listed on Nasdaq in the U.S. in May 2014.The company was founded by Liu Qiangdong in July 1998, and its retail platform went online in 2004. It started as an online magneto-optical store, but soon diversified, selling electronics, mobile phones, computers and similar items. The company changed its domain name to 360buy.com in June 2007 and then to JD.com in 2013. The latter purchase is understood to have cost $5,000,000. At the same time, JD.com announced its new logo and mascot. It is partly owned by Tencent, which has a 20% stake in the company.JD.com is the world's leading company in high tech and AI delivery through drones, autonomous technology and robots, and possesses the largest drone delivery system, infrastructure and capability in the world. It has recently started testing robotic delivery services and building drone delivery airports, as well as operating driverless delivery by unveiling its first autonomous truck."
"15","Papa John's Pizza is an American pizza restaurant franchise. It runs the fourth largest pizza delivery restaurant chain in the United States, with headquarters in Jeffersontown, Kentucky, a suburb of Louisville."
"16","Syneos Health (formerly InVentiv Health Incorporated and INC Research) is a NASDAQ listed American multinational contract research organization based in Morrisville, North Carolina. In January 2018 INC Research acquired inVentiv Health, the parent company of a subsidiary called Syneos, and the resulting company was named Syneos Health."
"17","Logitech International S.A. ( LOJ-ih-tek) is a Swiss provider of personal computer and mobile peripherals, with its headquarters in Lausanne, Switzerland and administrative headquarters in Newark, California. In addition to its Swiss and American facilities, the company has offices throughout Europe, Asia and the rest of the Americas. Logitech's sales and marketing activities are organized into three geographic regions: Americas, Europe, Middle East and Africa, and Asia Pacific.
The company develops and markets personal peripherals for PC navigation, video communication and collaboration, music and smart homes. This includes products like keyboards, mice, tablet accessories, webcams, Bluetooth speakers, universal remotes and more.
The name Logitech is derived from the French word for software, ""logiciel"". In Japan, Logitech was established as Logicool to avoid conflict with the Logitec brand."
"18","Qlik is a software company founded in 1993 in Lund, Sweden and now based in King of Prussia, Pennsylvania, United States whose main products are QlikView and Qlik Sense, both software for business intelligence & data visualization. Similar software dedicated to business users would include Crystal Reports by SAP, Tableau, or Sisense. For the more developer orientated audience, the library Shiny for R also allows to quickly build interactive web apps."
"19","Delcath Systems, Inc. Delcath Systems, Inc. (NASDAQ: DCTH) is a publicly-traded specialty pharmaceutical and medical device company that develops percutaneous perfusion technologies for the targeted administration of high-dose chemotherapeutic agents to specific organs or regions of the body. Based in Queensbury, New York, the company has an intellectual property portfolio consisting of 28 patents worldwide. Delcath's Percutaneous Hepatic Perfusion (PHP) is currently undergoing Phase II and Phase III trials against tumors in the liver. Delcath has a Cooperative Research and Development Agreement (CRADA) with the National Cancer Institute and has received Fast Track and a Special Protocol Assessment from the Food and Drug Administration for its use of melphalan in treating unresectable liver tumors. PHP, also known as the Delcath System, is tested for the treatment of metastatic melanoma in the liver and for primary liver cancer and metastatic hepatic malignancies from neuroendocrine cancers and adenocarcinomas, as well as patients with melanoma who previously received isolated perfusion. Chemotherapy is usually delivered intravenously, although a number of agents can be administered orally (e.g. specialty drugs, melphalan (trade name Alkeran), busulfan, capecitabine)."
"20","Leading Brands Inc. is a fully integrated beverage company in North America. Its operations include a coast-to-coast distribution network, large variety of brands, production of private label products and beverage distribution. The company is a publicly traded company on NASDAQ under the symbol ""LBIX"".
Leading Brands Incorporation was formerly named Brio Industries Inc., and changed its name in October 1999. The company started its earliest business in 1986. Its headquarters is now in Vancouver, Canada.The ticker symbol for Leading Brands Incorporation is ""LBIX""."
"21","NxStage Medical, Inc. is a publicly traded company (NASDAQ: NXTM) located in Lawrence, Massachusetts.  It is a medical device company that develops, manufactures and markets systems for the treatment of end-stage renal disease, acute kidney failure and fluid overload. 
In April 2002, IFS signed a contract with NxStage Medical, to provide IFS Applications(TM) business software to support the company's growing medical device business.In 2005, NxStage Medical received expanded 510(k) clearance from the FDA for its System One portable daily hemodialysis device. On Nov 2, 2005, NxStage Medical, Inc. received the Nixon Peabody/Smith & Nephew Medical Device Innovation Award in the Start-Up category from the Massachusetts Medical Device Industry Council (MassMEDIC). It received an ""honorable mention"" in the Wall Street Journal's 2006 Technology Innovation Awards.On Nov 27, 2006, NxStage Medical, Inc. appointed Robert S. Brown as Chief Financial Officer effective immediately. In 2017, the German healthcare company Fresenius Medical Care revealed its acquisition plans for NxStage. The deal was closed in February 2019."
"22","Weibo Corporation is the social network company which is providing the Chinese microblogging website Sina Weibo, based in Beijing, China."
"23","Overland Storage is a wholly owned subsidiary of Sphere 3D Corp. It has acquired Tandberg Data shortly before being acquired by Sphere 3D itself. The two subsidiaries were later rebranded under the common Overland-Tandberg brand."
"24","Advanced Micro Devices, Inc. (AMD) is an American multinational semiconductor company based in Santa Clara, California that develops computer processors and related technologies for business and consumer markets. While initially it manufactured its own processors, the company later outsourced its manufacturing, a practice known as fabless, after GlobalFoundries was spun off in 2009. AMD's main products include microprocessors, motherboard chipsets, embedded processors and graphics processors for servers, workstations and personal computers, and embedded systems applications.
AMD is the second-largest supplier and only significant rival to Intel in the market for x86-based microprocessors. Since acquiring ATI in 2006, AMD and its competitor Nvidia have maintained a duopoly in the discrete graphics processing unit (GPU) market."
"25","Smith Micro Software, Inc., founded in 1982 by William W. Smith, Jr., is a developer and marketer of both enterprise and consumer-level software and services. Headquartered in Pittsburgh, Pennsylvania, Smith Micro maintains multiple domestic and international offices.  United States locations include  Aliso Viejo, California, and Pittsburgh, Pennsylvania. International offices are located throughout Europe and Asia. Currently, the company focuses on digital lifestyle solutions and security technologies, and is integrated into the evolving wireless media industry, as indicated by partnerships with cellular service providers such as Verizon Wireless, AT&T, and Sprint Nextel."
"26","Tractor Supply Company (TSCO) is an American retail chain of stores that offers products for home improvement, agriculture, lawn and garden maintenance, and livestock, equine and pet care."
"27","Kite Pharma, a subsidiary of Gilead Sciences, develops cancer immunotherapy products with a primary focus on genetically engineered autologous T cell therapy with chimeric antigen receptors (CAR-T).
The Santa Monica, California-based company was founded in 2009 by Arie Belldegrun, M.D., FACS, an Israeli-American oncologist, who served as the company's chairman, president and chief executive officer.On August 28, 2017, Gilead Sciences announced that it would acquire Kite Pharma for $11.9 billion in an all-cash deal, equating to $180 cash per share. The deal will add the promising CAR-T candidate to Gilead's existing portfolio. The acquisition was completed in October 2017. In October 2017, Kite Pharma’s therapy, Yescarta (axicabtagene ciloleucel) became the first CAR-T therapy approved by the FDA for the treatment of adult patients with relapsed or refractory large B-cell lymphoma after two or more lines of systemic therapy.MIT Technology Review ranked Kite Pharma 7th in its annual list of 50 Smartest Companies 2017."
"28","Intellia Therapeutics is a biotechnology company developing biopharmaceuticals using a CRISPR gene editing system invented by Jennifer Doudna and colleagues at University of California. The company has partnerships with Novartis and Regeneron."
"29","AmTrust Financial Services, Inc., is a New York City-based multinational property and casualty insurance company. Operating through its subsidiaries, its operations are divided into three segments: Small Commercial Business insurance, Specialty Risk and Extended Warranty insurance, and Specialty Middle-Market Property and Casualty insurance. The company’s main regions of operations are North America, United Kingdom, and mainland Europe. AmTrust is listed on the NASDAQ Global Market under the ticker symbol AFSI and is rated “A-” (Excellent) by AM Best Company. Barry Zyskind is the Chief Executive Officer."
"30","Nvidia Corporation ( en-VID-ee-<U+0259>), more commonly referred to as Nvidia (stylized as NVIDIA), is an American technology company incorporated in Delaware and based in Santa Clara, California. It designs graphics processing units (GPUs) for the gaming and professional markets, as well as system on a chip units (SoCs) for the mobile computing and automotive market. Its primary GPU product line, labeled ""GeForce"", is in direct competition with Advanced Micro Devices' (AMD) ""Radeon"" products. Nvidia expanded its presence in the gaming industry with its handheld Shield Portable, Shield Tablet and Shield Android TV.
Since 2014, Nvidia has shifted to become a platform company focused on four markets – gaming, professional visualization, data centers and auto. Nvidia is also now focused on artificial intelligence.In addition to GPU manufacturing, Nvidia provides parallel processing capabilities to researchers and scientists that allow them to efficiently run high-performance applications. They are deployed in supercomputing sites around the world. More recently, it has moved into the mobile computing market, where it produces Tegra mobile processors for smartphones and tablets as well as vehicle navigation and entertainment systems. In addition to AMD, its competitors include Intel, Qualcomm and Arm (e.g., because of Denver, while Nvidia also licenses Arm's designs)."
"31","Clavister is a Swedish company specialized in network security solutions, listed on NASDAQ First North.
According to a report from 451 Research, the Edward Snowden NSA leaks and consequent loss of trust with US-based products has helped with the international expansion of Clavister.
Clavister has a global presence with customers such as the Japanese NTT-BP and the German Marbach Group. Also, the traffic of all 3.000 Regus business centers in more than 100 countries are protected by Clavister solutions.Clavister has partnerships with for example the Japanese Canon-ITS, and in the area of virtualized network security with Nokia Networks and Artesyn.Clavister has recently acquired the authentication solutions company PhenixID."
"32","BioLineRx (Hebrew: <U+05D1><U+05D9><U+05D5><U+05DC><U+05D9><U+05D9><U+05DF> <U+05D0><U+05E8> <U+05D0><U+05E7><U+05E1><U+200E>), or BioLine, is a publicly traded drug development company that seeks to discover compounds for disease treatment and develop them into commercializable drugs. Headquartered in Israel, its shares are traded on the NASDAQ Capital Market and on the Tel Aviv Stock Exchange."
"33","Pinnacle Financial Partners is a bank headquartered in Nashville, Tennessee operating in Middle Tennessee, East Tennessee, and, since June 2017, North Carolina, South Carolina, and Virginia."
"34","DASAN Zhone Solutions is a provider of telecommunications networking equipment founded in 1999. It is headquartered in Oakland, California. DZS is ISO 9001:2008 certified in the manufacture and service of telecommunications equipment."
"35","Ceragon Networks Ltd. provides high-capacity microwave Ethernet and TDM wireless backhaul to wireless service providers as well as private businesses.
Ceragon's offers Short-Haul and Long-Haul high capacity, point-to-point microwave systems in licensed spectrum (6–42 GHz) as well as sub-6 GHz and V-band (70–80 GHz) spectrum range."
"36","Halydean Corporation is a vertically integrated dairy and beef industry consolidation holding company. It is the oldest agricultural company in the world—founded in 1128 (1128) by 12th century Scottish king David I of Scotland. 
Throughout its history, the company passed from one propietorship to the next. Although founded by a Scottish monarch, it was operated by the Catholic Church which allowed it to enjoy perpetual tax exemption. In 1545, ownership passed hands to a Royal Burgh during the reign of Mary, Queen of Scots. During the reign of her son, the ""King of Great Britain and Ireland"" James VI and I, the company passed into private ownership, albeit assigned to various members of Scottish peerage.
The company's current incarnation can be traced back to 2014 when it was reorganized as a Delaware corporation. It is currently headquartered in Hayward, Wisconsin in the United States of America, but primarily consists of holdings in subsidiaries. In 2016, it became a publicly-traded company listed on the stock exchange. The company, a classic rollup, targets dairy facilities for mergers and acquisitions each worth an average $34 million USD, and is moving to increase its revenues from US export sales."
"37","Hasbro, Inc. (; a syllabic abbreviation of its original name, Hassenfeld Brothers) is an American worldwide toy and board game company. It is the largest toy maker in the world in terms of stock market value, and third largest with revenues of approximately $5.12 billion. Hasbro acquired the trademarks and products of Kenner, Parker Brothers, and Milton Bradley, among others. Among its products are Monopoly, G.I. Joe, Furby, Transformers, Nerf, My Little Pony, Twister and the Power Rangers franchise. The Hasbro brand also spawned TV shows to promote its products, such as Family Game Night  on the Discovery Family network. The corporate headquarters is located in Pawtucket, Rhode Island. The majority of its products are manufactured in East Asia."
"38","Qualstar Corporation (NASDAQ: QBAK) is an American manufacturer of magnetic tape data storage products, based in Simi Valley, California.  It was founded in 1984 as a 9 track tape drive manufacturer, and now makes tape library products.  The company sold its last 9 track tape drive in 2006 and as of March 2006 has sold all remaining parts inventory to Vinastar, an aftermarket vendor.Qualstar announced the TLS-4000 Series tape library family in 1994 and began shipment in 1995. Initially using Exabyte 8mm tape drives, the TLS-4000 Series was the first library product line to automate Sony's popular AIT drives. Leveraging the basic TLS design, Qualstar subsequently introduced the TLS-6000 Series for DLT and SDLT drives, the TLS-5000 Series for Sony SAIT drives and the TLS-8000 Series for LTO drives. The TLS-2000 Series for 4mm drives was also produced for a limited time. By 2011, only select models of the TLS-8000 family remain in production.
In 2001 the company introduced the first RLS-Series of rack mountable tape libraries. A number of models supporting AIT, SAIT, SDLT and LTO tape drive technologies were produced. The RLS-8000 Series for LTO technology continues in production. Various models house up to 44 tape cartridges and four LTO SAS or Fibre Channel tape drives in a 5U high package.
In 2010 Qualstar introduced the RLS-8500 Series that house up to 114 tapes and five LTO drives in a 10U high mechanism.
Qualstar entered the enterprise tape library market in 2006 with the XLS-Series Enterprise Library System. Using patented technology, the XLS-Series introduced interchangeable Library Resource Modules (LRMs)and storage modules (MEMs) in highly flexible configurations that could be combined to exceed 7,000 tapes and 128 LTO tape drives. The XLS family has continued to expand, adding four more LRM models and a second MEM module. XLS models currently span capacities from 160 slots to over 11,000 slots and can house over 150 drives."
